{
  "format": "nightshift.test-spec/v0",
  "id": "coins-visible",
  "instruction": "The coins are visible.",
  "objects": {
    "coin": {
      "prompt": "gold coin"
    }
  },
  "assertion": {
    "type": "visible",
    "object": "coin"
  },
  "window": {
    "fromFrame": 0,
    "toFrame": 119
  }
}
