{
  "format": "nightshift.test-spec/v0",
  "id": "player-reaches-end-of-route",
  "instruction": "The player reaches the end of the smoke route (keeps moving; a freeze is not a fix).",
  "objects": {
    "player": {
      "prompt": "small robot character"
    },
    "goal": {
      "prompt": "route end marker"
    }
  },
  "assertion": {
    "type": "reaches",
    "object": "player",
    "goal": "goal",
    "distancePx": 200
  },
  "window": {
    "fromFrame": 0,
    "toFrame": 119
  },
  "approval": {
    "by": "taofeek",
    "at": "2026-10-27T16:00:00Z"
  }
}
